    {
        "id": 2120,
        "email": "hello@gmail.com",
        "name": "H",
        "package_params": {
            "width": 120,            
            "height": 70
        },
        "location_and_quantity": [
            {
                "location": "Иннополис",
                "amount": 17
            },
{
                "location": "Москва",
                "amount": 1
            },
            {
                "location": "Казань",
                "amount": 34
            }
        ]
    }